{
  "batch_id": "batch_compra-amazon_20251218_164204",
  "press_release": {
    "headline": "Introducing SafeClick: Seamless Shopping with Control and Confidence",
    "one_liner": "SafeClick combines the speed of 1-click shopping with customizable verification steps for a secure and controlled purchase experience.",
    "problem_statement": "Customers avoid using the 'Buy with 1-Click' feature due to fears of accidental purchases, lack of control over payment options, and the need to verify details such as seller ratings, delivery address, and item specifics, leading to anxiety and missed opportunities for convenience.",
    "solution_overview": "SafeClick offers a configurable 1-click shopping experience that allows customers to enable verification steps such as payment method selection, address confirmation, and seller checks while retaining the speed and simplicity of instant purchases with features like quick undo and customizable purchase limits."
  },
  "faq": [
    {
      "question": "How does SafeClick address the fear of accidental purchases?",
      "answer": "SafeClick includes an undo option, allowing customers to cancel purchases within a 10-30 second window, providing peace of mind and reducing anxiety over mistaken orders.",
      "customer_segment": "Nat\u00e1lia - Desconfiado"
    },
    {
      "question": "Can I customize the verification steps in SafeClick?",
      "answer": "Yes, customers can configure SafeClick to include verification for specific categories, price limits, and require steps such as confirming payment methods and delivery addresses before completing a purchase.",
      "customer_segment": "Juliana - Desconfiado"
    },
    {
      "question": "What measures are included for payment security in SafeClick?",
      "answer": "SafeClick allows users to choose installment options before finalizing the purchase and supports additional security measures like biometric verification for higher-value transactions.",
      "customer_segment": "Alana - Relator"
    },
    {
      "question": "How does SafeClick enhance the trust in seller and product reviews?",
      "answer": "SafeClick displays seller ratings, exchange policies, and authentic user reviews with photos directly on the product page, helping users make informed decisions without leaving the purchase flow.",
      "customer_segment": "Ravy - Literal"
    },
    {
      "question": "Is SafeClick available for all types of products?",
      "answer": "SafeClick is customizable and can be activated or deactivated based on product categories or price thresholds, ensuring it meets the unique needs of different shopping scenarios.",
      "customer_segment": "Ravy - Literal"
    },
    {
      "question": "What happens if I want to review my order before confirming it?",
      "answer": "SafeClick provides a summary overlay with key details such as final price, seller information, payment method, and delivery address, allowing users to verify these before completing the purchase.",
      "customer_segment": "Alana - Relator"
    },
    {
      "question": "Can I use SafeClick for recurring purchases?",
      "answer": "Yes, SafeClick supports a 're-order' mode for repeated purchases, providing a streamlined process for items you buy frequently, enhancing convenience while maintaining control.",
      "customer_segment": "Ravy - Literal"
    },
    {
      "question": "How does SafeClick improve the overall shopping experience?",
      "answer": "By combining speed with optional verification steps, SafeClick reduces the friction of online shopping while keeping users informed and in control, thus building trust and reducing the perceived risks of fast purchases.",
      "customer_segment": "Nat\u00e1lia - Desconfiado"
    }
  ],
  "generated_at": "2025-12-19T13:23:43.459878",
  "version": 1,
  "edit_history": [],
  "validation_status": "valid",
  "confidence_score": 1.0
}