{
  "batch_id": "test_batch_001",
  "press_release": {
    "headline": "Introducing DocSynth: Revolutionizing B2B SaaS Research with Automated PR-FAQ Generation",
    "one_liner": "AI-driven tool that transforms interview data into PR-FAQ documents, minimizing manual effort and ensuring consistency.",
    "problem_statement": "Product Managers at B2B SaaS companies are overwhelmed with manual document coordination, spending 40% of their time on repetitive tasks and facing confusion from version chaos across platforms like email, Slack, and Google Docs.",
    "solution_overview": "DocSynth automates the synthesis of research interviews into standardized PR-FAQ documents, reducing time spent on manual tasks from weeks to days, while providing robust version control, collaboration features, and multiple export formats to meet diverse enterprise security and compliance needs."
  },
  "faq": [
    {
      "question": "How does DocSynth save time for Product Managers?",
      "answer": "DocSynth cuts down the manual synthesis process from 3-5 weeks to just a few days by automatically generating PR-FAQ documents from interview data, allowing Product Managers to focus on strategic tasks.",
      "customer_segment": "Product Manager"
    },
    {
      "question": "What are the key features of DocSynth?",
      "answer": "DocSynth offers automated PR-FAQ generation, standardized documentation formats, version control, collaboration features, and supports export to PDF, Markdown, and HTML.",
      "customer_segment": "Product Manager"
    },
    {
      "question": "How does DocSynth handle security and compliance?",
      "answer": "DocSynth is built with a security-first architecture that complies with SOC2, HIPAA, and GDPR standards, ensuring that enterprise security teams can trust the platform with sensitive data.",
      "customer_segment": "Enterprise Security Team"
    },
    {
      "question": "Can DocSynth integrate with existing enterprise tools?",
      "answer": "Yes, DocSynth offers pre-built integrations with Slack, Jira, and Confluence, simplifying the integration complexity with existing enterprise tools.",
      "customer_segment": "IT Administrator"
    },
    {
      "question": "How does DocSynth ensure document consistency and version control?",
      "answer": "DocSynth standardizes document formats across projects and provides robust version control features, reducing confusion from document version chaos.",
      "customer_segment": "Product Manager"
    },
    {
      "question": "What pricing options are available for different team sizes?",
      "answer": "DocSynth offers flexible pricing tailored to small teams and enterprise deployments, making it a cost-effective solution for teams of all sizes.",
      "customer_segment": "Finance"
    },
    {
      "question": "What support does DocSynth provide for small teams?",
      "answer": "For small teams, DocSynth emphasizes ease-of-use and quick setup, allowing them to get started with minimal hassle.",
      "customer_segment": "Small Team Enthusiast"
    },
    {
      "question": "Why choose DocSynth over traditional methods?",
      "answer": "DocSynth not only automates repetitive tasks but also enhances pattern recognition across projects by ensuring consistency, which is crucial for strategic decision-making.",
      "customer_segment": "Product Manager"
    }
  ],
  "generated_at": "2025-12-19T12:43:42.952201",
  "version": 1,
  "edit_history": [],
  "validation_status": "valid",
  "confidence_score": 0.9924999999999999
}